{
  "catalogVersion": "2.0",
  "api": {
    "id": "fx",
    "title": "Frankfurter Exchange Rates API",
    "version": "1.0.0"
  },
  "provenance": {
    "sourceType": "openapi",
    "sourceChecksum": "sha256:4f768e0133a69eccb55ddcebf11d21f3c28e2f719434dee8054c3ee93147df7c",
    "generatedAt": "2026-08-09T18:26:30.912Z",
    "compilerVersion": "0.1.0",
    "confidence": 1,
    "warnings": [
      {
        "code": "INFERRED_RISK",
        "message": "operation fx.latest risk inferred as \"read\" from method GET"
      }
    ]
  },
  "checksum": "sha256:0523160ffb96a1f5004b86a44f4a8e1386d538f40d35c2e98dcdd6416743d286",
  "securitySchemes": {},
  "operations": {
    "fx.latest": {
      "enabled": true,
      "available": true,
      "method": "GET",
      "path": "/v1/latest",
      "summary": "Get the latest exchange rates",
      "description": "Return the latest reference rates for a base currency.",
      "tags": ["fx"],
      "risk": "read",
      "confirmation": "never",
      "timeoutMs": 30000,
      "maxRequestBytes": 10485760,
      "maxResponseBytes": 10485760,
      "maxConcurrency": 4,
      "security": [],
      "request": {
        "parameters": {
          "query": [
            {
              "in": "query",
              "name": "base",
              "required": false,
              "description": "Base currency code.",
              "schema": {
                "type": "string",
                "default": "EUR"
              }
            },
            {
              "in": "query",
              "name": "symbols",
              "required": false,
              "description": "Comma-separated target currency codes.",
              "schema": {
                "type": "string",
                "default": "USD"
              }
            }
          ]
        }
      },
      "responses": {
        "200": {
          "description": "Latest reference rates.",
          "contentTypes": ["application/json"],
          "schema": {
            "type": "object",
            "required": ["amount", "base", "date", "rates"],
            "properties": {
              "amount": {
                "type": "number"
              },
              "base": {
                "type": "string"
              },
              "date": {
                "type": "string"
              },
              "rates": {
                "type": "object",
                "additionalProperties": {
                  "type": "number"
                }
              }
            }
          }
        }
      }
    }
  }
}
