{
  "catalogVersion": "2.0",
  "api": {
    "id": "weather",
    "title": "Open-Meteo Forecast API",
    "version": "1.0.0"
  },
  "provenance": {
    "sourceType": "openapi",
    "sourceChecksum": "sha256:8737c390f9dfe7994b57eeb001c8841db15710f11ab93fa4ea4454d496acddbb",
    "generatedAt": "2026-08-11T06:41:06.500Z",
    "compilerVersion": "0.1.0",
    "confidence": 1,
    "warnings": [
      {
        "code": "INFERRED_RISK",
        "message": "operation weather.forecast risk inferred as \"read\" from method GET"
      }
    ]
  },
  "checksum": "sha256:9b52995ebafb6986f63ea516a036a069ea0c3b35af9bd3dd49f3e6066e775668",
  "securitySchemes": {},
  "operations": {
    "weather.forecast": {
      "enabled": true,
      "available": true,
      "method": "GET",
      "path": "/v1/forecast",
      "summary": "Get a weather forecast",
      "description": "Return current conditions and a short forecast for coordinates.",
      "tags": ["weather"],
      "risk": "read",
      "confirmation": "never",
      "timeoutMs": 30000,
      "maxRequestBytes": 10485760,
      "maxResponseBytes": 10485760,
      "maxConcurrency": 4,
      "security": [],
      "request": {
        "parameters": {
          "query": [
            {
              "in": "query",
              "name": "latitude",
              "required": true,
              "description": "Latitude in decimal degrees.",
              "schema": {
                "type": "number",
                "minimum": -90,
                "maximum": 90
              }
            },
            {
              "in": "query",
              "name": "longitude",
              "required": true,
              "description": "Longitude in decimal degrees.",
              "schema": {
                "type": "number",
                "minimum": -180,
                "maximum": 180
              }
            },
            {
              "in": "query",
              "name": "current",
              "required": false,
              "description": "Comma-separated current weather variables.",
              "schema": {
                "type": "string",
                "default": "temperature_2m,precipitation,rain,wind_speed_10m"
              }
            },
            {
              "in": "query",
              "name": "daily",
              "required": false,
              "description": "Comma-separated daily forecast variables.",
              "schema": {
                "type": "string",
                "default": "precipitation_probability_max,wind_speed_10m_max"
              }
            },
            {
              "in": "query",
              "name": "forecast_days",
              "required": false,
              "description": "Number of forecast days.",
              "schema": {
                "type": "integer",
                "minimum": 1,
                "maximum": 16,
                "default": 2
              }
            },
            {
              "in": "query",
              "name": "timezone",
              "required": false,
              "description": "IANA timezone or auto for the coordinate.",
              "schema": {
                "type": "string",
                "default": "auto"
              }
            }
          ]
        }
      },
      "responses": {
        "200": {
          "description": "Weather conditions and forecast.",
          "contentTypes": ["application/json"],
          "schema": {
            "type": "object",
            "additionalProperties": true
          }
        }
      }
    }
  }
}
